Date, predictions
1-1-2020, apple buger chocolate donuts garlic icecream ketchup oranges pasta yougurt quicee carrot rice oliveoil yam nut tomato vegetables mutton spaghetti wings
2-1-2020,chocolate egg honey icecream ketchup mango pasta quicee popcorn nut tomato perisauces mutton
3-1-2020,apple buger chocolate donuts garlic jelly ketchup lemons pasta yougurt carrot rice oliveoil yam tomato mutton spaghetti wings
4-1-2020,chocolate,donuts,garlic,jelly,ketchup,orange,yam,tomato
...,...
10-1-2020,apple buger chocolate donuts garlic jelly ketchup lemons pasta,carrot,nut,tomato.mutton,wings